{
  "id": "calc-ab-2008-frq-6",
  "subject": "ap-calculus-ab",
  "year": 2008,
  "source": "released",
  "title": "f(x) = ln(x)/x — Tangent Line at e², Critical Point, Inflection Point, Limit as x→0⁺",
  "frq_type": "multi_part_math",
  "related_units": [2, 5],
  "calculator_allowed": false,
  "total_points": 9,
  "stimulus": "Let $f$ be the function given by $f(x) = \\dfrac{\\ln x}{x}$ for all $x > 0$. The derivative of $f$ is given by $f'(x) = \\dfrac{1 - \\ln x}{x^2}$.",
  "stimulus_image": null,
  "documents": null,
  "parts": [
    {
      "letter": "a",
      "prompt": "Write an equation for the line tangent to the graph of $f$ at $x = e^2$.",
      "point_value": 2,
      "rubric_criteria": [
        "1 pt: Computes $f(e^2) = \\dfrac{\\ln e^2}{e^2} = \\dfrac{2}{e^2}$ and $f'(e^2) = \\dfrac{1 - \\ln e^2}{(e^2)^2} = \\dfrac{1 - 2}{e^4} = -\\dfrac{1}{e^4}$",
        "1 pt: Correct tangent line equation: $y = \\dfrac{2}{e^2} - \\dfrac{1}{e^4}\\left(x - e^2\\right)$"
      ],
      "scoring_notes": "From scoring key: $f(e^2) = 2/e^2$, $f'(e^2) = -1/e^4$. Tangent line: $y = \\frac{2}{e^2} - \\frac{1}{e^4}(x - e^2)$.",
      "requires_drawing": false,
      "reference_image": null
    },
    {
      "letter": "b",
      "prompt": "Find the $x$-coordinate of the critical point of $f$. Determine whether this point is a relative minimum, a relative maximum, or neither for the function $f$. Justify your answer.",
      "point_value": 3,
      "rubric_criteria": [
        "1 pt: Sets $f'(x) = 0$: $1 - \\ln x = 0 \\Rightarrow x = e$",
        "1 pt: Correct classification: relative maximum at $x = e$",
        "1 pt: Justification: $f'(x)$ changes from positive to negative at $x = e$ (i.e., $f'(x) > 0$ for $0 < x < e$ and $f'(x) < 0$ for $x > e$)"
      ],
      "scoring_notes": "From scoring key: $f'(x) = 0$ when $1 - \\ln x = 0$, so $x = e$. This is a relative maximum because $f'$ changes from positive to negative at $x = e$.",
      "requires_drawing": false,
      "reference_image": null
    },
    {
      "letter": "c",
      "prompt": "The graph of the function $f$ has exactly one point of inflection. Find the $x$-coordinate of this point.",
      "point_value": 3,
      "rubric_criteria": [
        "2 pts: Computes $f''(x)$ correctly: $f''(x) = \\dfrac{-\\frac{1}{x} \\cdot x^2 - (1 - \\ln x) \\cdot 2x}{x^4} = \\dfrac{-3 + 2\\ln x}{x^3}$",
        "1 pt: Sets $f''(x) = 0$: $-3 + 2\\ln x = 0 \\Rightarrow x = e^{3/2}$; this is an inflection point because $f''$ changes sign at $x = e^{3/2}$"
      ],
      "scoring_notes": "From scoring key: $f''(x) = (-3 + 2\\ln x)/x^3$. $f''(x) = 0$ when $2\\ln x = 3$, so $x = e^{3/2}$. $f''$ changes sign at $x = e^{3/2}$, confirming an inflection point.",
      "requires_drawing": false,
      "reference_image": null
    },
    {
      "letter": "d",
      "prompt": "Find $\\displaystyle\\lim_{x \\to 0^+} f(x)$.",
      "point_value": 1,
      "rubric_criteria": [
        "1 pt: Correct limit: $\\displaystyle\\lim_{x \\to 0^+} \\frac{\\ln x}{x} = -\\infty$ (or Does Not Exist)"
      ],
      "scoring_notes": "From scoring key: As $x \\to 0^+$, $\\ln x \\to -\\infty$ and $x \\to 0^+$, so $\\ln x / x \\to -\\infty$. Answer $-\\infty$ or DNE are both accepted.",
      "requires_drawing": false,
      "reference_image": null
    }
  ]
}
