{
  "id": "chem-2018-frq-6",
  "subject": "ap-chemistry",
  "year": 2018,
  "source": "released",
  "title": "Electrochemical Cells & Cell Potential",
  "frq_type": "multi_part_math",
  "related_units": [
    4,
    9
  ],
  "calculator_allowed": true,
  "total_points": 4,
  "stimulus": "A student sets up a galvanic cell at 298 K that has an electrode of Ag(s) immersed in a 1.0 M solution of\nAg+(aq) and an electrode of Cr(s) immersed in a 1.0 M solution of Cr3+(aq), as shown in the diagram above.",
  "stimulus_image": "/data/ap-chemistry/frq/images/chem-2018-frq-6-stimulus.png",
  "documents": null,
  "parts": [
    {
      "letter": "a",
      "prompt": "The student measures the voltage of the cell shown above and discovers that it is zero. Identify the missing\ncomponent of the cell, and explain its importance for obtaining a nonzero voltage.\nHalf-Reaction E° (V)\nAg+(aq) + e − → Ag(s) +0.80\nCr3+(aq) + 3 e − → Cr(s) ?",
      "point_value": 1,
      "rubric_criteria": [],
      "scoring_notes": null,
      "requires_drawing": false,
      "reference_image": null
    },
    {
      "letter": "b",
      "prompt": "The student adds the missing component to the cell and measures\nE\nto be +1.54 V. As the cell operates,\ncell\nAg+ ions are reduced. Use this information and the information in the table above to do the following.\n(i) Calculate the value of E° for the half-reaction Cr3+(aq) + 3 e − → Cr(s).\n(ii) Write the balanced net-ionic equation for the overall reaction that occurs as the cell operates.\n(iii) Calculate the value of ΔG° for the overall cell reaction in J/mol\nrxn\n.",
      "point_value": 1,
      "rubric_criteria": [],
      "scoring_notes": null,
      "requires_drawing": false,
      "reference_image": null
    }
  ]
}
