{
  "id": "world-2023-set2-saq-4",
  "subject": "ap-world-history",
  "year": 2023,
  "source": "released",
  "title": "Short Answer Question — AP World History",
  "frq_type": "saq",
  "related_units": [
    3,
    4,
    6,
    9
  ],
  "calculator_allowed": false,
  "total_points": 3,
  "stimulus": null,
  "stimulus_image": null,
  "documents": null,
  "parts": [
    {
      "letter": "a",
      "prompt": "Identify ONE historical development that contributed to the growth of a global economy during the\nperiod circa 1800–1914.",
      "point_value": 1,
      "rubric_criteria": [
        "1 pt: Historically defensible response addressing the prompt."
      ],
      "scoring_notes": null,
      "requires_drawing": false,
      "reference_image": null
    },
    {
      "letter": "b",
      "prompt": "Explain ONE way governments responded to economic crises or depressions during the period circa\n1900–1945.",
      "point_value": 1,
      "rubric_criteria": [
        "1 pt: Historically defensible response addressing the prompt."
      ],
      "scoring_notes": null,
      "requires_drawing": false,
      "reference_image": null
    },
    {
      "letter": "c",
      "prompt": "Explain ONE way states changed their economies in response to the shifting global balance of power\nduring the period circa 1945–1990.\n4\nEND OF SECTION I\n5\nWORLD HISTORY: MODERN",
      "point_value": 1,
      "rubric_criteria": [
        "1 pt: Historically defensible response addressing the prompt."
      ],
      "scoring_notes": null,
      "requires_drawing": false,
      "reference_image": null
    }
  ]
}