{
  "id": "calc-bc-2023-frq-5",
  "subject": "ap-calculus-bc",
  "year": 2023,
  "source": "released",
  "title": "Rate & Accumulation (Riemann Sums)",
  "frq_type": "multi_part_math",
  "related_units": [
    1,
    2,
    6
  ],
  "calculator_allowed": false,
  "total_points": 9,
  "stimulus": "The graphs of the functions f and g are shown in the figure for 0 £ x £ 3. It is known that g",
  "stimulus_image": "/data/ap-calculus-bc/frq/images/calc-bc-2023-frq-5-stimulus.png",
  "documents": null,
  "parts": [
    {
      "letter": "a",
      "prompt": "Find the area of the shaded region enclosed by the graphs of f and g.\n∞",
      "point_value": 3,
      "rubric_criteria": [
        "=10 − ⌠ 3 12 dx =10 −12 [ ln 3+ x ]3 Antiderivative of 1 point",
        "=10 −12(ln6 − ln3) =10 −12(ln2) Answer 1 point",
        "• The second point is earned for finding a ⌠ dx = a⋅ln 3+ x or a⋅ln(3+ x).",
        "example, ⌠ 3 12 dx = ⌠ 312 du =12 [ ln(x + 3)]3 ."
      ],
      "scoring_notes": null,
      "requires_drawing": false,
      "reference_image": null
    },
    {
      "letter": "b",
      "prompt": "Evaluate the improper integral ∫ (g(x)) dx, or show that the integral diverges.",
      "point_value": 3,
      "rubric_criteria": [
        "∫ ∞ (g(x))2 dx = lim ⌠  b 144 dx Limit notation 1 point",
        "= lim − + = 48",
        "example, lim  du = lim − ."
      ],
      "scoring_notes": null,
      "requires_drawing": false,
      "reference_image": null
    },
    {
      "letter": "c",
      "prompt": "Let h be the function defined by h(x ) = x ◊ f ¢(x). Find the value of ∫ h(x) dx.\n__________________________________________________________\nWrite your responses to this question only on the designated pages in the separate Free Response\nbooklet. Write your solution to each part in the space provided for that part.",
      "point_value": 3,
      "rubric_criteria": [
        "u = x dv = f′(x) dx",
        "du = dx v = f(x)",
        "∫h(x) dx = ∫x⋅ f′(x) dx = x⋅ f(x) − ∫ f(x) dx ∫h(x) dx 1 point",
        "= x⋅ f(x) − ∫ f(x) dx"
      ],
      "scoring_notes": null,
      "requires_drawing": false,
      "reference_image": null
    }
  ]
}