{
  "id": "precalc-gen-a4",
  "subject": "ap-precalculus",
  "year": null,
  "source": "generated",
  "title": "Symbolic Manipulation: Logarithm Properties, Trig Identities & Inverse Functions",
  "frq_type": "multi_part_math",
  "related_units": [2, 3],
  "calculator_allowed": false,
  "total_points": 6,
  "stimulus": null,
  "stimulus_image": null,
  "documents": null,
  "parts": [
    {
      "letter": "a",
      "prompt": "(i) Rewrite $\\log_3(81x^2) - \\log_3(9x)$ as a single logarithm or simplified expression. Show the properties of logarithms used.\n\n(ii) Solve $2^{3x-1} = 5^x$ for $x$. Express your answer as an exact value.",
      "point_value": 2,
      "rubric_criteria": [
        "1 pt: Correct simplification — $\\log_3(81x^2) - \\log_3(9x) = \\log_3\\left(\\frac{81x^2}{9x}\\right) = \\log_3(9x) = 2 + \\log_3(x)$; equivalent forms such as $\\log_3(9x)$ or $2 + \\log_3 x$ all earn the point",
        "1 pt: Correct exact solution — taking $\\ln$ of both sides: $(3x-1)\\ln 2 = x\\ln 5 \\Rightarrow 3x\\ln 2 - \\ln 2 = x\\ln 5 \\Rightarrow x(3\\ln 2 - \\ln 5) = \\ln 2 \\Rightarrow x = \\frac{\\ln 2}{3\\ln 2 - \\ln 5}$; accept equivalent exact forms such as $x = \\frac{\\ln 2}{\\ln 8 - \\ln 5} = \\frac{\\ln 2}{\\ln(8/5)}$"
      ],
      "scoring_notes": "For part (i), the key steps are quotient rule then simplification; $\\log_3(9x) = \\log_3 9 + \\log_3 x = 2 + \\log_3 x$. Either form is correct. For part (ii), decimal approximations are not accepted — must be an exact form involving $\\ln$ or $\\log$. Common error: forgetting to distribute $\\ln 2$ across $(3x-1)$.",
      "requires_drawing": false,
      "reference_image": null
    },
    {
      "letter": "b",
      "prompt": "(i) Use a trigonometric identity to simplify $\\frac{\\sin^2(\\theta)}{1 - \\cos^2(\\theta)} \\cdot \\tan(\\theta)$. Show the identities used and simplify completely.\n\n(ii) Find all solutions to $2\\cos^2(\\theta) - \\cos(\\theta) - 1 = 0$ on the interval $0 \\leq \\theta < 2\\pi$. Express answers as exact values.",
      "point_value": 2,
      "rubric_criteria": [
        "1 pt: Correct simplification — $1 - \\cos^2(\\theta) = \\sin^2(\\theta)$, so $\\frac{\\sin^2(\\theta)}{\\sin^2(\\theta)} \\cdot \\tan(\\theta) = 1 \\cdot \\tan(\\theta) = \\tan(\\theta)$; supporting work must show the Pythagorean identity being applied",
        "1 pt: Correct factoring and all solutions — $2\\cos^2\\theta - \\cos\\theta - 1 = (2\\cos\\theta + 1)(\\cos\\theta - 1) = 0$, giving $\\cos\\theta = -\\frac{1}{2}$ or $\\cos\\theta = 1$; solutions are $\\theta = \\frac{2\\pi}{3}$, $\\theta = \\frac{4\\pi}{3}$, and $\\theta = 0$; all three required with no incorrect values"
      ],
      "scoring_notes": "For part (i), the Pythagorean identity $\\sin^2\\theta + \\cos^2\\theta = 1$ must be explicitly invoked (at least implicitly by substituting $1 - \\cos^2\\theta = \\sin^2\\theta$). The simplified result $\\tan\\theta$ must appear. For part (ii), the equation is a quadratic in $\\cos\\theta$. All three solutions ($0$, $2\\pi/3$, $4\\pi/3$) must be present. Note: $\\theta = 2\\pi$ is not in the domain $[0, 2\\pi)$.",
      "requires_drawing": false,
      "reference_image": null
    },
    {
      "letter": "c",
      "prompt": "(i) Evaluate $\\sin\\left(\\arctan\\left(\\frac{3}{4}\\right)\\right)$ without a calculator. Express your answer as an exact fraction. Show supporting work.\n\n(ii) Determine the domain and range of $y = \\arctan(x)$. Explain why the range must be restricted compared to $y = \\tan(x)$.",
      "point_value": 2,
      "rubric_criteria": [
        "1 pt: Correct exact value $\\sin\\left(\\arctan\\left(\\frac{3}{4}\\right)\\right) = \\frac{3}{5}$; supporting work must show a right triangle with opposite $= 3$, adjacent $= 4$, hypotenuse $= \\sqrt{9+16} = 5$, so $\\sin = \\frac{3}{5}$",
        "1 pt: Correct domain $(-\\infty, \\infty)$ (all real numbers) and range $\\left(-\\frac{\\pi}{2}, \\frac{\\pi}{2}\\right)$ AND a valid explanation — the range of $\\arctan$ must be restricted to an interval where $\\tan$ is one-to-one so that $\\arctan$ is itself a function (each input has exactly one output)"
      ],
      "scoring_notes": "For part (i), the triangle method is the expected approach. Accept equivalent fractions. For part (ii), both domain and range must be stated correctly. The explanation must connect 'one-to-one' or 'each input maps to exactly one output' with the need for restriction. A response stating only 'because $\\tan$ is periodic' without explaining the one-to-one requirement is insufficient for the second point.",
      "requires_drawing": false,
      "reference_image": null
    }
  ]
}
