{
  "id": "calc-bc-2022-frq-3",
  "subject": "ap-calculus-bc",
  "year": 2022,
  "source": "released",
  "title": "Rate & Accumulation (Riemann Sums)",
  "frq_type": "multi_part_math",
  "related_units": [
    1,
    2,
    5,
    6
  ],
  "calculator_allowed": false,
  "total_points": 9,
  "stimulus": "Let f be a differentiable function with f (4) = 3. On the interval 0 £ x £ 7, the graph of f ¢, the derivative\nof f , consists of a semicircle and two line segments, as shown in the figure above.",
  "stimulus_image": "/data/ap-calculus-bc/frq/images/calc-bc-2022-frq-3-stimulus.png",
  "documents": null,
  "parts": [
    {
      "letter": "a",
      "prompt": "Find f (0) and f (5) .",
      "point_value": 3,
      "rubric_criteria": [
        "f ( 0 ) = f ( 4 ) + ∫ f ′( x ) dx = 3 − ∫ f′( x) dx = +3 π2",
        "f ( 5 ) = f ( 4 ) + ∫ f ′( x ) dx = 3 + = 4",
        "• A response with answers of only f (0) = ± π2 , or only f (5) = , or both earns 1 of the 3 points.",
        "• A response displaying f (5) = and a missing or incorrect value for f (0) earns 2 of the 3 points."
      ],
      "scoring_notes": "must be labeled as either f (0) or f (5) in order to earn any points.",
      "requires_drawing": false,
      "reference_image": null
    },
    {
      "letter": "b",
      "prompt": "Find the x-coordinates of all points of inflection of the graph of f for 0 < x < 7. Justify your answer.",
      "point_value": 2,
      "rubric_criteria": [
        "The graph of f has a point of inflection at each of x = 2 and Answer 1 point",
        "x = 6, because f′( x) changes from decreasing to increasing at Justification 1 point",
        "x = 2 and from increasing to decreasing at x = 6.",
        "• A response that gives only one of x = 2 or x = 6, along with a correct justification, earns 1 of the"
      ],
      "scoring_notes": null,
      "requires_drawing": true,
      "reference_image": null
    },
    {
      "letter": "c",
      "prompt": "Let g be the function defined by g(x ) = f (x ) − x. On what intervals, if any, is g decreasing for\n0 £ x £ 7 ? Show the analysis that leads to your answer.",
      "point_value": 2,
      "rubric_criteria": [
        "g′( x) = f′( x) − 1 g′( x) = f′( x) − 1 1 point"
      ],
      "scoring_notes": null,
      "requires_drawing": false,
      "reference_image": null
    },
    {
      "letter": "d",
      "prompt": "For the function g defined in part (c), find the absolute minimum value on the interval 0 £ x £ 7. Justify\nyour answer.\n__________________________________________________________\nWrite your responses to this question only on the designated pages in the separate Free Response\nbooklet. Write your solution to each part in the space provided for that part.\nt\n03 7 10 12\n(days)\nr¢(t)\n−6.1 −5.0 −4.4 −3.8 −3.5\n(centimeters per day)",
      "point_value": 2,
      "rubric_criteria": [
        "g is continuous, g′(x ) < 0 for 0 < x < 5, and g′(x ) > 0 for Considers g′(x) = 0 1 point",
        "Therefore, the absolute minimum occurs at x = 5, and",
        "g(5 ) = f(5 ) −5 = −5 = − is the absolute minimum value",
        "changes from decreasing to increasing) at x = 5 ” must also state that x = 5 is the only critical"
      ],
      "scoring_notes": null,
      "requires_drawing": false,
      "reference_image": null
    }
  ]
}