{
  "id": "world-2025-set1-saq-1",
  "subject": "ap-world-history",
  "year": 2025,
  "source": "released",
  "title": "Women & Gender in History",
  "frq_type": "saq",
  "related_units": [
    1,
    2,
    3,
    4,
    5,
    6
  ],
  "calculator_allowed": false,
  "total_points": 3,
  "stimulus": "“Asia experienced a temporary gain from the discovery of America, but Africa suffered.\nAmerica had all the silver and gold Europe needed, and this destroyed the African gold markets\nand the dependent trade networks. Cities such as Timbuktu and the Songhai Empire of which it\nwas a part crumbled as merchants abandoned the ancient trade routes.\nTo replace the Mediterranean trade of cloth, beads, leather, and metals upon which the\nAfricans had become dependent, the Africans now had only one commodity that the Europeans\nwanted—slaves. For centuries the African merchants had sold a small but steady number of\nslaves to the Middle East, but with the decline of their traditional European trade and with the\nopening of America, the slave trade became a boom. The Africans thus became victims of the\ndiscovery of America as surely as did the American Indians.”\nSource: Jack Weatherford, United States anthropologist, academic book, 1988",
  "stimulus_image": null,
  "documents": null,
  "parts": [
    {
      "letter": "a",
      "prompt": "Identify one claim that the author makes in the first paragraph about the effect of the\ndiscovery of the Americas on Africa.",
      "point_value": 1,
      "rubric_criteria": [
        "1 pt: The African gold markets were destroyed.",
        "1 pt: It resulted in the decline of cities and empires in Africa.",
        "1 pt: It caused the abandonment of ancient trade routes."
      ],
      "scoring_notes": null,
      "requires_drawing": false,
      "reference_image": null
    },
    {
      "letter": "b",
      "prompt": "Describe one economic change in the Americas that occurred as a result of the developments\ndiscussed in the second paragraph.",
      "point_value": 1,
      "rubric_criteria": [
        "1 pt: The plantation system in the Americas became widespread.",
        "1 pt: The increased availability of enslaved labor from Africa further developed the pattern of triangular trade between Europe, Africa, and the Americas.",
        "1 pt: The decrease in Indigenous labor in the Americas created a demand for an increased number of enslaved laborers from Africa."
      ],
      "scoring_notes": null,
      "requires_drawing": false,
      "reference_image": null
    },
    {
      "letter": "c",
      "prompt": "Explain one reason why “American Indians” “became victims of the discovery of America” as\nsuggested by the author in the last sentence of the passage.\nAP WORLD HISTORY: MODERN 2025 n FREE-RESPONSE QUESTIONS",
      "point_value": 1,
      "rubric_criteria": [
        "1 pt: The Columbian Exchange resulted in a high death rate for Native Americans due to the introduction of diseases originating in Afro-Eurasia.",
        "1 pt: With the arrival of the Spanish and the introduction of new labor systems, such as the encomienda and hacienda systems, Native American labor was exploited.",
        "1 pt: Native American tribes lost their ancestral homelands as European colonists took over land for economic gain.",
        "1 pt: Europeans often forced Christianization on Native Americans that resulted in the loss of cultural traditions."
      ],
      "scoring_notes": null,
      "requires_drawing": false,
      "reference_image": null
    }
  ]
}