{
  "id": "chem-2023-frq-2",
  "subject": "ap-chemistry",
  "year": 2023,
  "source": "released",
  "title": "Chemical Equilibrium & Le Chatelier's Principle",
  "frq_type": "multi_part_math",
  "related_units": [
    2,
    6,
    7
  ],
  "calculator_allowed": true,
  "total_points": 10,
  "stimulus": "2. In the gas phase, AlCl is a molecular substance. A reaction of gaseous AlCl at high temperature is represented\nby the following balanced equation.\nReaction 1: AlCl (g) → Al(g) + 3Cl(g) ΔH \u0002 = ?\n3 1",
  "stimulus_image": null,
  "documents": null,
  "parts": [
    {
      "letter": "a",
      "prompt": "How many grams of Cl(g) can be formed from 1.25 mol of AlCl (g) ?\nAdditional reactions that involve Al or Cl are shown in the following table.\n\u0002\nReaction Number Equation ΔH (kJ/mol )\nrxn rxn\n2 Al(s) + $Cl_2$ ( g) → AlCl 3 (g) −583\n3 Al(s) → Al(g) +326\n4 Cl (g) → 2Cl(g) +243",
      "point_value": 1,
      "rubric_criteria": [
        "For the correct calculated value reported with the correct number of significant figures: 1 point"
      ],
      "scoring_notes": null,
      "requires_drawing": false,
      "reference_image": null
    },
    {
      "letter": "b",
      "prompt": "Calculate the value of ΔH , in kJ/mol , for reaction 1 above using reactions 2, 3, and 4.\n1 rxn",
      "point_value": 2,
      "rubric_criteria": [
        "For the correct algebraic manipulation of either",
        "Accept one of the following:",
        "AlCl (g) → Al(s) + 3Cl (g) ∆H = −(−583) = +583 kJ/mol",
        "For the correct calculated value: 1 point"
      ],
      "scoring_notes": "Accept one of the following:",
      "requires_drawing": false,
      "reference_image": null
    },
    {
      "letter": "c",
      "prompt": "A potential energy diagram for Cl is shown in the following graph.\n(i) Based on the graph, what is the bond length, in picometers, for Cl ? _________\n(ii) A student finds that the average Al − Cl bond length is 220 picometers and the average bond energy is\n425 kJ/mol. Draw the potential energy curve for the average Al − Cl bond on the preceding graph.",
      "point_value": 3,
      "rubric_criteria": [
        "(i) For the correct answer: 1 point",
        "(ii) For a curve with a minimum at an internuclear distance of 220 ±10 pm: 1 point",
        "See sample curve below",
        "For a curve with a minimum energy value of −425± 20 kJ/mol that approaches zero as the 1 point"
      ],
      "scoring_notes": null,
      "requires_drawing": true,
      "reference_image": "/data/ap-chemistry/frq/images/chem-2023-frq-2-c-ref.png"
    },
    {
      "letter": "d",
      "prompt": "Three proposed Lewis diagrams for the AlCl (g) molecule are shown.\n(i) The AlCl (g) molecule has a trigonal planar geometry. Which diagram (1, 2, or 3) can be eliminated\nbased on geometry? Justify your choice based on VSEPR theory.\n\n(ii) Which of the three diagrams is the best representation for the bonding in AlCl ? Justify your choice\nbased on formal charges.\nAlCl is known to dimerize reversibly in the gas phase. The dimerization equilibrium is represented by the\nfollowing equation.\n2AlCl (g) \u0003 Al Cl (g)\n3 2 6",
      "point_value": 2,
      "rubric_criteria": [
        "(i) For the correct answer and a valid justification: 1 point",
        "Diagram 2. Al has four electron domains in Diagram 2, which would be trigonal pyramidal,",
        "(ii) For the correct answer and a valid justification: 1 point",
        "Diagram 1. All atoms in diagram 1 have a formal charge of zero, whereas atoms in"
      ],
      "scoring_notes": null,
      "requires_drawing": false,
      "reference_image": "/data/ap-chemistry/frq/images/chem-2023-frq-2-d-ref.png"
    },
    {
      "letter": "e",
      "prompt": "Write the expression for the equilibrium constant, K , for this reaction.\np\nA particle-level diagram of an equilibrium mixture of AlCl (g) and Al Cl (g) at 400°C in a 25 L closed\n3 2 6\ncontainer is shown.",
      "point_value": 1,
      "rubric_criteria": [
        "For the correct answer: 1 point"
      ],
      "scoring_notes": null,
      "requires_drawing": false,
      "reference_image": "/data/ap-chemistry/frq/images/chem-2023-frq-2-e-ref.png"
    },
    {
      "letter": "f",
      "prompt": "Using the particle-level diagram, calculate the value of K for the reaction if the total pressure in the container\np\nis 22.1 atm.",
      "point_value": 1,
      "rubric_criteria": [
        "For the correct calculated value, consistent with part (e): 1 point",
        "K = Al2Cl6 total = 10 = 0.0277"
      ],
      "scoring_notes": null,
      "requires_drawing": false,
      "reference_image": null
    }
  ]
}
